StaID,station_nm,huc_cd,state,county
04263000,OSWEGATCHIE RIVER NEAR HEUVELTON NY,4150302,New York,St. Lawrence County
04266500,RAQUETTE RIVER AT PIERCEFIELD NY,4150305,New York,St. Lawrence County
04268000,RAQUETTE RIVER AT RAYMONDVILLE NY,4150305,New York,St. Lawrence County
04269000,ST. REGIS RIVER AT BRASHER CENTER NY,4150306,New York,St. Lawrence County
04273500,SARANAC RIVER AT PLATTSBURGH NY,4150406,New York,Clinton County
04280000,"POULTNEY RIVER BELOW FAIR HAVEN, VT",4150401,Vermont,Rutland County
04282000,"OTTER CREEK AT CENTER RUTLAND, VT",4150402,Vermont,Rutland County
04282500,"OTTER CREEK AT MIDDLEBURY, VT",4150402,Vermont,Addison County
04285500,"NORTH BRANCH WINOOSKI RIVER AT WRIGHTSVILLE, VT",4150403,Vermont,Washington County
04286000,"WINOOSKI RIVER AT MONTPELIER, VT",4150403,Vermont,Washington County
04287000,"DOG RIVER AT NORTHFIELD FALLS, VT",4150403,Vermont,Washington County
04288000,"MAD RIVER NEAR MORETOWN, VT",4150403,Vermont,Washington County
04289000,"LITTLE RIVER NEAR WATERBURY, VT",4150403,Vermont,Washington County
04290500,"WINOOSKI RIVER NEAR ESSEX JUNCTION, VT",4150403,Vermont,Chittenden County
04292000,"LAMOILLE RIVER AT JOHNSON, VT",4150405,Vermont,Lamoille County
04292500,"LAMOILLE RIVER AT EAST GEORGIA, VT",4150405,Vermont,Franklin County
04296000,"BLACK RIVER AT COVENTRY, VT",4150500,Vermont,Orleans County
04296500,"CLYDE RIVER AT NEWPORT, VT",4150500,Vermont,Orleans County
05014500,Swiftcurrent Creek at Many Glacier MT,9040001,Montana,Glacier County
05017500,St. Mary River near Babb MT,9040001,Montana,Glacier County
05046000,"OTTER TAIL RIVER BL ORWELL D NR FERGUS FALLS, MN",9020103,Minnesota,Otter Tail County
05050000,"BOIS DE SIOUX RIVER NEAR WHITE ROCK, SD",9020101,South Dakota,Roberts County
05051522,"RED RIVER OF THE NORTH AT HICKSON, ND",9020104,North Dakota,Cass County
05053000,"WILD RICE RIVER NR ABERCROMBIE, ND",9020105,North Dakota,Richland County
05054000,"RED RIVER OF THE NORTH AT FARGO, ND",9020104,North Dakota,Cass County
05054500,"SHEYENNE RIVER ABOVE HARVEY, ND",9020202,North Dakota,Wells County
05056000,"SHEYENNE RIVER NR WARWICK, ND",9020203,North Dakota,Eddy County
05057000,"SHEYENNE RIVER NR COOPERSTOWN, ND",9020203,North Dakota,Griggs County
05057200,"BALDHILL CREEK NR DAZEY, ND",9020203,North Dakota,Barnes County
05058000,"SHEYENNE RIVER BELOW BALDHILL DAM, ND",9020204,North Dakota,Barnes County
05058700,"SHEYENNE RIVER AT LISBON, ND",9020204,North Dakota,Ransom County
05059000,"SHEYENNE RIVER NEAR KINDRED, ND",9020204,North Dakota,Cass County
05059500,"SHEYENNE RIVER AT WEST FARGO, ND",9020204,North Dakota,Cass County
05059700,"MAPLE RIVER NR ENDERLIN, ND",9020205,North Dakota,Ransom County
05060500,"RUSH RIVER AT AMENIA, ND",9020204,North Dakota,Cass County
05062000,"BUFFALO RIVER NEAR DILWORTH, MN",9020106,Minnesota,Clay County
05064000,"WILD RICE RIVER AT HENDRUM, MN",9020108,Minnesota,Norman County
05066500,"GOOSE RIVER AT HILLSBORO, ND",9020109,North Dakota,Traill County
05069000,"SAND HILL RIVER AT CLIMAX, MN",9020301,Minnesota,Polk County
05076000,"THIEF RIVER NEAR THIEF RIVER FALLS, MN",9020304,Minnesota,Marshall County
05078000,"CLEARWATER RIVER AT PLUMMER, MN",9020305,Minnesota,Red Lake County
05078230,"LOST RIVER AT OKLEE, MN",9020305,Minnesota,Red Lake County
05078500,"CLEARWATER RIVER AT RED LAKE FALLS, MN",9020305,Minnesota,Red Lake County
05079000,"RED LAKE RIVER AT CROOKSTON, MN",9020303,Minnesota,Polk County
05084000,"FOREST RIVER NR FORDVILLE, ND",9020308,North Dakota,Walsh County
05085000,"FOREST RIVER AT MINTO, ND",9020308,North Dakota,Walsh County
05090000,"PARK RIVER AT GRAFTON, ND",9020310,North Dakota,Walsh County
05104500,"ROSEAU RIVER BELOW SOUTH FORK NEAR MALUNG, MN",9020314,Minnesota,Roseau County
05116500,"DES LACS RIVER AT FOXHOLM, ND",9010002,North Dakota,Ward County
05120500,"WINTERING RIVER NEAR KARLSRUHE, ND",9010003,North Dakota,McHenry County
05123400,"WILLOW CREEK NEAR WILLOW CITY, ND",9010004,North Dakota,McHenry County
05124480,"KAWISHIWI RIVER NEAR ELY, MN",9030001,Minnesota,Lake County
05127000,"KAWISHIWI RIVER NEAR WINTON, MN",9030001,Minnesota,Lake County
05127500,"BASSWOOD RIVER NEAR WINTON, MN",9030001,Minnesota,Lake County
05129115,"VERMILION RIVER NR CRANE LAKE, MN",9030002,Minnesota,St. Louis County
05131500,"LITTLE FORK RIVER AT LITTLEFORK, MN",9030005,Minnesota,Koochiching County
05211000,"MISSISSIPPI RIVER AT GRAND RAPIDS, MN",7010103,Minnesota,Itasca County
05227500,"MISSISSIPPI RIVER AT AITKIN, MN",7010104,Minnesota,Aitkin County
05245100,"LONG PRAIRIE RIVER AT LONG PRAIRIE, MN",7010108,Minnesota,Todd County
05247500,"CROW WING RIVER NEAR PILLAGER, MN",7010106,Minnesota,Cass County
05267000,"MISSISSIPPI RIVER NEAR ROYALTON, MN",7010201,Minnesota,Morrison County
05280000,"CROW RIVER AT ROCKFORD, MN",7010204,Minnesota,Hennepin County
05286000,"RUM RIVER NEAR ST. FRANCIS, MN",7010207,Minnesota,Anoka County
05287890,"ELM CREEK NR CHAMPLIN, MN",7010206,Minnesota,Hennepin County
05291000,"WHETSTONE RIVER NEAR BIG STONE CITY, SD",7020001,South Dakota,Grant County
05292000,"MINNESOTA RIVER AT ORTONVILLE, MN",7020001,Minnesota,Big Stone County
05293000,"YELLOW BANK RIVER NEAR ODESSA, MN",7020001,Minnesota,Lac qui Parle County
05300000,"LAC QUI PARLE RIVER NEAR LAC QUI PARLE, MN",7020003,Minnesota,Lac qui Parle County
05304500,"CHIPPEWA RIVER NEAR MILAN, MN",7020005,Minnesota,Chippewa County
05311000,"MINNESOTA RIVER AT MONTEVIDEO, MN",7020004,Minnesota,Yellow Medicine County
05313500,"YELLOW MEDICINE RIVER NEAR GRANITE FALLS, MN",7020004,Minnesota,Yellow Medicine County
05315000,"REDWOOD RIVER NEAR MARSHALL, MN",7020006,Minnesota,Lyon County
05316500,"REDWOOD RIVER NEAR REDWOOD FALLS, MN",7020006,Minnesota,Redwood County
05317000,"COTTONWOOD RIVER NEAR NEW ULM, MN",7020008,Minnesota,Brown County
05319500,"WATONWAN RIVER NEAR GARDEN CITY, MN",7020010,Minnesota,Blue Earth County
05320000,"BLUE EARTH RIVER NEAR RAPIDAN, MN",7020009,Minnesota,Blue Earth County
05320500,"LE SUEUR RIVER NEAR RAPIDAN, MN",7020011,Minnesota,Blue Earth County
05325000,"MINNESOTA RIVER AT MANKATO, MN",7020007,Minnesota,Blue Earth County
05330000,"MINNESOTA RIVER NEAR JORDAN, MN",7020012,Minnesota,Carver County
05336700,"KETTLE RIVER BELOW SANDSTONE, MN",7030003,Minnesota,Pine County
05340500,"ST. CROIX RIVER AT ST. CROIX FALLS, WI",7030005,Wisconsin,Polk County
05345000,"VERMILLION RIVER NEAR EMPIRE, MN",7040001,Minnesota,Dakota County
05353800,"STRAIGHT RIVER NEAR FARIBAULT, MN",7040002,Minnesota,Rice County
05356000,"CHIPPEWA RIVER AT BISHOPS BRIDGE NEAR WINTER, WI",7050001,Wisconsin,Sawyer County
05356500,"CHIPPEWA RIVER NEAR BRUCE, WI",7050001,Wisconsin,Rusk County
05360500,"FLAMBEAU RIVER NEAR BRUCE, WI",7050002,Wisconsin,Rusk County
05362000,"JUMP RIVER AT SHELDON, WI",7050004,Wisconsin,Rusk County
05368000,"HAY RIVER AT WHEELER, WI",7050007,Wisconsin,Dunn County
05369000,"RED CEDAR RIVER AT MENOMONIE, WI",7050007,Wisconsin,Dunn County
05369500,"CHIPPEWA RIVER AT DURAND, WI",7050005,Wisconsin,Pepin County
05370000,"EAU GALLE RIVER AT SPRING VALLEY, WI",7050005,Wisconsin,Pierce County
05372995,"SOUTH FORK ZUMBRO RIVER AT ROCHESTER, MN",7040004,Minnesota,Olmsted County
05379500,"TREMPEALEAU RIVER AT DODGE, WI",7040005,Wisconsin,Trempealeau County
05381000,"BLACK RIVER AT NEILLSVILLE, WI",7040007,Wisconsin,Clark County
05382000,"BLACK RIVER NEAR GALESVILLE, WI",7040007,Wisconsin,La Crosse County
05388250,"Upper Iowa River near Dorchester, IA",7060002,Iowa,Allamakee County
05391000,"WISCONSIN RIVER @ RAINBOW LAKE NR LAKE TOMAHAWK,WI",7070001,Wisconsin,Oneida County
05393500,"SPIRIT RIVER AT SPIRIT FALLS, WI",7070001,Wisconsin,Lincoln County
05394500,"PRAIRIE RIVER NEAR MERRILL, WI",7070002,Wisconsin,Lincoln County
05395000,"WISCONSIN RIVER AT MERRILL, WI",7070002,Wisconsin,Lincoln County
05397500,"EAU CLAIRE RIVER AT KELLY, WI",7070002,Wisconsin,Marathon County
05399500,"BIG EAU PLEINE RIVER AT STRATFORD, WI",7070002,Wisconsin,Marathon County
05404000,"WISCONSIN RIVER NEAR WISCONSIN DELLS, WI",7070003,Wisconsin,Sauk County
05405000,"BARABOO RIVER NEAR BARABOO, WI",7070004,Wisconsin,Sauk County
05406500,"BLACK EARTH CREEK AT BLACK EARTH, WI",7070005,Wisconsin,Dane County
05407000,"WISCONSIN RIVER AT MUSCODA, WI",7070005,Wisconsin,Grant County
05408000,"KICKAPOO RIVER AT LA FARGE, WI",7070006,Wisconsin,Vernon County
05412500,"Turkey River at Garber, IA",7060004,Iowa,Clayton County
05413500,"GRANT RIVER AT BURTON, WI",7060003,Wisconsin,Grant County
05414000,"PLATTE RIVER NEAR ROCKVILLE, WI",7060003,Wisconsin,Grant County
05414820,"SINSINAWA RIVER NEAR MENOMINEE, IL",7060005,Illinois,Jo Daviess County
05418500,"Maquoketa River near Maquoketa, IA",7060006,Iowa,Jackson County
05419000,"APPLE RIVER NEAR HANOVER, IL",7060005,Illinois,Jo Daviess County
05421000,"Wapsipinicon River at Independence, IA",7080102,Iowa,Buchanan County
05422000,"Wapsipinicon River near De Witt, IA",7080103,Iowa,Clinton County
05425500,"ROCK RIVER AT WATERTOWN, WI",7090001,Wisconsin,Jefferson County
05426000,"CRAWFISH RIVER AT MILFORD, WI",7090002,Wisconsin,Jefferson County
05426250,"BARK RIVER NEAR ROME, WI",7090001,Wisconsin,Jefferson County
05427948,"PHEASANT BRANCH AT MIDDLETON, WI",7090001,Wisconsin,Dane County
05429500,"YAHARA RIVER AT MC FARLAND, WI",7090002,Wisconsin,Dane County
05430150,"BADFISH CREEK NEAR COOKSVILLE, WI",7090001,Wisconsin,Rock County
05430175,"YAHARA RIVER NEAR FULTON, WI",7090001,Wisconsin,Rock County
05430500,"ROCK RIVER AT AFTON, WI",7090001,Wisconsin,Rock County
05431486,"TURTLE CREEK AT CARVERS ROCK ROAD NEAR CLINTON, WI",7090001,Wisconsin,Rock County
05432500,"PECATONICA RIVER AT DARLINGTON, WI",7090003,Wisconsin,Lafayette County
05433000,"EAST BRANCH PECATONICA RIVER NR BLANCHARDVILLE, WI",7090003,Wisconsin,Lafayette County
05434500,"PECATONICA RIVER AT MARTINTOWN, WI",7090003,Wisconsin,Green County
05435500,"PECATONICA RIVER AT FREEPORT, IL",7090003,Illinois,Stephenson County
05436500,"SUGAR RIVER NEAR BRODHEAD, WI",7090004,Wisconsin,Green County
05437500,"ROCK RIVER AT ROCKTON, IL",7090005,Illinois,Winnebago County
05438500,"KISHWAUKEE RIVER AT BELVIDERE, IL",7090006,Illinois,Boone County
05439000,"SOUTH BRANCH KISHWAUKEE RIVER AT DEKALB, IL",7090006,Illinois,DeKalb County
05439500,SOUTH BRANCH KISHWAUKEE RIVER NR FAIRDALE IL,7090006,Illinois,DeKalb County
05440000,"KISHWAUKEE RIVER NEAR PERRYVILLE, IL",7090006,Illinois,Winnebago County
05444000,"ELKHORN CREEK NEAR PENROSE, IL",7090005,Illinois,Whiteside County
05446500,"ROCK RIVER NEAR JOSLIN, IL",7090005,Illinois,Rock Island County
05447500,"GREEN RIVER NEAR GENESEO, IL",7090007,Illinois,Henry County
05449500,"Iowa River near Rowan, IA",7080207,Iowa,Wright County
05451500,"Iowa River at Marshalltown, IA",7080208,Iowa,Marshall County
05451700,"Timber Creek near Marshalltown, IA",7080208,Iowa,Marshall County
05451900,"Richland Creek near Haven, IA",7080208,Iowa,Tama County
05452000,"Salt Creek near Elberon, IA",7080208,Iowa,Tama County
05452200,"Walnut Creek near Hartwick, IA",7080208,Iowa,Poweshiek County
05453000,"Big Bear Creek at Ladora, IA",7080208,Iowa,Iowa County
05453100,"Iowa River at Marengo, IA",7080208,Iowa,Iowa County
05454000,"Rapid Creek near Iowa City, IA",7080209,Iowa,Johnson County
05454300,"Clear Creek near Coralville, IA",7080209,Iowa,Johnson County
05454500,"Iowa River at Iowa City, IA",7080209,Iowa,Johnson County
05455500,"English River at Kalona, IA",7080209,Iowa,Washington County
05455700,"Iowa River near Lone Tree, IA",7080209,Iowa,Louisa County
05457000,"CEDAR RIVER NEAR AUSTIN, MN",7080201,Minnesota,Mower County
05458000,"Little Cedar River near Ionia, IA",7080201,Iowa,Chickasaw County
05458500,"Cedar River at Janesville, IA",7080201,Iowa,Bremer County
05458900,"West Fork Cedar River at Finchford, IA",7080204,Iowa,Black Hawk County
05459500,"Winnebago River at Mason City, IA",7080203,Iowa,Cerro Gordo County
05463000,"Beaver Creek at New Hartford, IA",7080205,Iowa,Butler County
05464000,"Cedar River at Waterloo, IA",7080205,Iowa,Black Hawk County
05464500,"Cedar River at Cedar Rapids, IA",7080205,Iowa,Linn County
05465000,"Cedar River near Conesville, IA",7080206,Iowa,Muscatine County
05465500,"Iowa River at Wapello, IA",7080209,Iowa,Louisa County
05466000,"EDWARDS RIVER NEAR ORION, IL",7080104,Illinois,Henry County
05466500,"EDWARDS RIVER NEAR NEW BOSTON, IL",7080104,Illinois,Mercer County
05469000,"HENDERSON CREEK NEAR OQUAWKA, IL",7080104,Illinois,Henderson County
05470500,"Ioway Creek at Ames, IA",7080105,Iowa,Story County
05471500,"South Skunk River near Oskaloosa, IA",7080105,Iowa,Mahaska County
05472500,"North Skunk River near Sigourney, IA",7080106,Iowa,Keokuk County
05473400,"Cedar Creek near Oakland Mills, IA",7080107,Iowa,Henry County
05474000,"Skunk River at Augusta, IA",7080107,Iowa,Des Moines County
05476000,"DES MOINES RIVER AT JACKSON, MN",7100001,Minnesota,Jackson County
05476750,"Des Moines River at Humboldt, IA",7100002,Iowa,Humboldt County
05479000,"East Fork Des Moines River at Dakota City, IA",7100003,Iowa,Humboldt County
05480500,"Des Moines River at Fort Dodge, IA",7100004,Iowa,Webster County
05481000,"Boone River near Webster City, IA",7100005,Iowa,Hamilton County
05481300,"Des Moines River near Stratford, IA",7100004,Iowa,Webster County
05481650,"Des Moines River near Saylorville, IA",7100004,Iowa,Polk County
05481950,"Beaver Creek near Grimes, IA",7100004,Iowa,Polk County
05482300,"North Raccoon River near Sac City, IA",7100006,Iowa,Sac County
05482500,"North Raccoon River near Jefferson, IA",7100006,Iowa,Greene County
05483450,"Middle Raccoon River near Bayard, IA",7100007,Iowa,Guthrie County
05483600,"Middle Raccoon River at Panora, IA",7100007,Iowa,Guthrie County
05484000,"South Raccoon River at Redfield, IA",7100007,Iowa,Dallas County
05484500,"Raccoon River at Van Meter, IA",7100006,Iowa,Dallas County
05484800,"Walnut Creek at Des Moines, IA",7100006,Iowa,Polk County
05485500,"Des Moines River blw Raccoon Riv at Des Moines, IA",7100008,Iowa,Polk County
05486000,"North River near Norwalk, IA",7100008,Iowa,Warren County
05486490,"Middle River near Indianola, IA",7100008,Iowa,Warren County
05487470,"South River near Ackworth, IA",7100008,Iowa,Warren County
05487980,"White Breast Creek near Dallas, IA",7100008,Iowa,Marion County
05488500,"Des Moines River near Tracy, IA",7100009,Iowa,Mahaska County
05489000,"Cedar Creek near Bussey, IA",7100009,Iowa,Marion County
05489500,"Des Moines River at Ottumwa, IA",7100009,Iowa,Wapello County
05490500,"Des Moines River at Keosauqua, IA",7100009,Iowa,Van Buren County
05495000,"Fox River at Wayland, MO",7110001,Missouri,Clark County
05495500,"BEAR CREEK NEAR MARCELLINE, IL",7110001,Illinois,Adams County
05496000,"Wyaconda River above Canton, MO",7110001,Missouri,Lewis County
05500000,"South Fabius River near Taylor, MO",7110003,Missouri,Marion County
05501000,"North River at Palmyra, MO",7110004,Missouri,Marion County
05502000,"Bear Creek at Hannibal, MO",7110004,Missouri,Ralls County
05502300,"North Fork Salt River at Hagers Grove, MO",7110005,Missouri,Shelby County
05503800,"Crooked Creek near Paris, MO",7110005,Missouri,Monroe County
05504800,"South Fork Salt River above Santa Fe, MO",7110006,Missouri,Audrain County
05506800,"Elk Fork Salt River near Madison, MO",7110006,Missouri,Monroe County
05507600,"Lick Creek at Perry, MO",7110007,Missouri,Ralls County
05507800,"Salt River near Center, MO",7110007,Missouri,Ralls County
05508000,"Salt River near New London, MO",7110007,Missouri,Ralls County
05508805,"Spencer Creek below Plum Creek near Frankford, MO",7110007,Missouri,Ralls County
05512500,"BAY CREEK AT PITTSFIELD, IL",7110004,Illinois,Pike County
05514500,"Cuivre River near Troy, MO",7110008,Missouri,Lincoln County
05515500,"KANKAKEE RIVER AT DAVIS, IN",7120001,Indiana,Starke County
05516500,"YELLOW RIVER AT PLYMOUTH, IN",7120001,Indiana,Marshall County
05517000,"YELLOW RIVER AT KNOX, IN",7120001,Indiana,Starke County
05517500,"KANKAKEE RIVER AT DUNNS BRIDGE, IN",7120001,Indiana,Porter County
05517530,"KANKAKEE RIVER NR KOUTS, IN",7120001,Indiana,Jasper County
05518000,"KANKAKEE RIVER AT SHELBY, IN",7120001,Indiana,Newton County
05520500,"KANKAKEE RIVER AT MOMENCE, IL",7120001,Illinois,Kankakee County
05522500,"IROQUOIS RIVER AT RENSSELAER, IN",7120002,Indiana,Jasper County
05524500,"IROQUOIS RIVER NEAR FORESMAN, IN",7120002,Indiana,Newton County
05525000,"IROQUOIS RIVER AT IROQUOIS, IL",7120002,Illinois,Iroquois County
05525500,"SUGAR CREEK AT MILFORD, IL",7120002,Illinois,Iroquois County
05526000,"IROQUOIS RIVER NEAR CHEBANSE, IL",7120002,Illinois,Kankakee County
05527500,"KANKAKEE RIVER NEAR WILMINGTON, IL",7120001,Illinois,Will County
05527800,"DES PLAINES RIVER AT RUSSELL, IL",7120004,Illinois,Lake County
05528000,"DES PLAINES RIVER NEAR GURNEE, IL",7120004,Illinois,Lake County
05528500,"BUFFALO CREEK NEAR WHEELING, IL",7120004,Illinois,Cook County
05529000,"DES PLAINES RIVER NEAR DES PLAINES, IL",7120004,Illinois,Cook County
05529500,"MC DONALD CREEK NEAR MOUNT PROSPECT, IL",7120004,Illinois,Cook County
05530990,"SALT CREEK AT ROLLING MEADOWS, IL",7120004,Illinois,Cook County
05531500,"SALT CREEK AT WESTERN SPRINGS, IL",7120004,Illinois,Cook County
05532000,"ADDISON CREEK AT BELLWOOD, IL",7120004,Illinois,Cook County
05532500,"DES PLAINES RIVER AT RIVERSIDE, IL",7120004,Illinois,Cook County
05533000,"FLAG CREEK NEAR WILLOW SPRINGS, IL",7120004,Illinois,Cook County
05534500,"NORTH BRANCH CHICAGO RIVER AT DEERFIELD, IL",7120003,Illinois,Lake County
05535000,"SKOKIE RIVER AT LAKE FOREST, IL",7120003,Illinois,Lake County
05535070,"SKOKIE RIVER NEAR HIGHLAND PARK, IL",7120003,Illinois,Lake County
05535500,WF OF NB CHICAGO RIVER AT NORTHBROOK IL,7120003,Illinois,Cook County
05536000,"NORTH BRANCH CHICAGO RIVER AT NILES, IL",7120003,Illinois,Cook County
05536195,"LITTLE CALUMET RIVER AT MUNSTER, IN",7120003,Indiana,Lake County
05536215,"THORN CREEK AT GLENWOOD, IL",7120003,Illinois,Cook County
05536235,"DEER CREEK NEAR CHICAGO HEIGHTS, IL",7120003,Illinois,Cook County
05536255,"BUTTERFIELD CREEK AT FLOSSMOOR, IL",7120003,Illinois,Cook County
05536275,"THORN CREEK AT THORNTON, IL",7120003,Illinois,Cook County
05536290,"LITTLE CALUMET RIVER AT SOUTH HOLLAND, IL",7120003,Illinois,Cook County
05536340,"MIDLOTHIAN CREEK AT OAK FOREST, IL",7120003,Illinois,Cook County
05536500,"TINLEY CREEK NEAR PALOS PARK, IL",7120003,Illinois,Cook County
05537500,"LONG RUN NEAR LEMONT, IL",7120004,Illinois,Cook County
05539000,"HICKORY CREEK AT JOLIET, IL",7120004,Illinois,Will County
05539900,"WEST BRANCH DU PAGE RIVER NEAR WEST CHICAGO, IL",7120004,Illinois,DuPage County
05540095,"WEST BRANCH DU PAGE RIVER NEAR WARRENVILLE, IL",7120004,Illinois,DuPage County
05540500,"DU PAGE RIVER AT SHOREWOOD, IL",7120004,Illinois,Will County
05543500,"ILLINOIS RIVER AT MARSEILLES, IL",7120005,Illinois,LaSalle County
05543830,"FOX RIVER AT WAUKESHA, WI",7120006,Wisconsin,Waukesha County
05544200,"MUKWONAGO RIVER AT MUKWONAGO, WI",7120006,Wisconsin,Waukesha County
05548280,"NIPPERSINK CREEK NEAR SPRING GROVE, IL",7120006,Illinois,McHenry County
05550500,"POPLAR CREEK AT ELGIN, IL",7120006,Illinois,Cook County
05551200,"FERSON CREEK NEAR ST. CHARLES, IL",7120007,Illinois,Kane County
05551700,"BLACKBERRY CREEK NEAR YORKVILLE, IL",7120007,Illinois,Kendall County
05552500,"FOX RIVER AT DAYTON, IL",7120007,Illinois,LaSalle County
05554500,"VERMILION RIVER AT PONTIAC, IL",7130002,Illinois,Livingston County
05555300,"VERMILION RIVER NEAR LEONORE, IL",7130002,Illinois,LaSalle County
05556500,"BIG BUREAU CREEK AT PRINCETON, IL",7130001,Illinois,Bureau County
05558300,"ILLINOIS RIVER AT HENRY, IL",7130001,Illinois,Marshall County
05567500,"MACKINAW RIVER NEAR CONGERVILLE, IL",7130004,Illinois,Woodford County
05568500,"ILLINOIS RIVER AT KINGSTON MINES, IL",7130003,Illinois,Peoria County
05568800,"INDIAN CREEK NEAR WYOMING, IL",7130005,Illinois,Stark County
05569500,"SPOON RIVER AT LONDON MILLS, IL",7130005,Illinois,Fulton County
05570000,"SPOON RIVER AT SEVILLE, IL",7130005,Illinois,Fulton County
05570910,"SANGAMON RIVER AT FISHER, IL",7130006,Illinois,Champaign County
05572000,"SANGAMON RIVER AT MONTICELLO, IL",7130006,Illinois,Piatt County
05576000,"SOUTH FORK SANGAMON RIVER NEAR ROCHESTER, IL",7130007,Illinois,Sangamon County
05577500,"SPRING CREEK AT SPRINGFIELD, IL",7130008,Illinois,Sangamon County
05578500,"SALT CREEK NEAR ROWELL, IL",7130009,Illinois,De Witt County
05579500,"LAKE FORK NEAR CORNLAND, IL",7130009,Illinois,Logan County
05580000,"KICKAPOO CREEK AT WAYNESVILLE, IL",7130009,Illinois,De Witt County
05580950,"SUGAR CREEK NEAR BLOOMINGTON, IL",7130009,Illinois,McLean County
05582000,"SALT CREEK NEAR GREENVIEW, IL",7130009,Illinois,Menard County
05583000,"SANGAMON RIVER NEAR OAKFORD, IL",7130008,Illinois,Mason County
05584500,"LA MOINE RIVER AT COLMAR, IL",7130010,Illinois,McDonough County
05585000,"LA MOINE RIVER AT RIPLEY, IL",7130010,Illinois,Brown County
05587000,"MACOUPIN CREEK NEAR KANE, IL",7130012,Illinois,Greene County
05587900,"CAHOKIA CREEK AT EDWARDSVILLE, IL",7140101,Illinois,Madison County
05588000,"INDIAN CREEK AT WANDA, IL",7140101,Illinois,Madison County
05590800,"LAKE FORK AT ATWOOD, IL",7140201,Illinois,Piatt County
05591200,"KASKASKIA RIVER AT COOKS MILLS, IL",7140201,Illinois,Coles County
05591550,"WHITLEY CREEK NEAR ALLENVILLE, IL",7140201,Illinois,Moultrie County
05591700,"WEST OKAW RIVER NEAR LOVINGTON, IL",7140201,Illinois,Moultrie County
05592000,"KASKASKIA RIVER AT SHELBYVILLE, IL",7140201,Illinois,Shelby County
05592050,"ROBINSON CREEK NEAR SHELBYVILLE, IL",7140201,Illinois,Shelby County
05592100,"KASKASKIA RIVER NEAR COWDEN, IL",7140201,Illinois,Shelby County
05592500,"KASKASKIA RIVER AT VANDALIA, IL",7140202,Illinois,Fayette County
05592800,"HURRICANE CREEK NEAR MULBERRY GROVE, IL",7140202,Illinois,Fayette County
05592900,"EAST FORK KASKASKIA RIVER NEAR SANDOVAL, IL",7140202,Illinois,Marion County
05593000,"KASKASKIA RIVER AT CARLYLE, IL",7140202,Illinois,Clinton County
05593575,"LITTLE CROOKED CREEK NEAR NEW MINDEN, IL",7140202,Illinois,Washington County
05593900,"EAST FORK SHOAL CREEK NEAR COFFEEN, IL",7140203,Illinois,Montgomery County
05594000,"SHOAL CREEK NEAR BREESE, IL",7140203,Illinois,Clinton County
05594100,"KASKASKIA RIVER NEAR VENEDY STATION, IL",7140204,Illinois,Washington County
05594450,"SILVER CREEK NEAR TROY, IL",7140204,Illinois,Madison County
05594800,"SILVER CREEK NEAR FREEBURG, IL",7140204,Illinois,St. Clair County
05595200,"RICHLAND CREEK NEAR HECKER, IL",7140204,Illinois,St. Clair County
05595730,"RAYSE CREEK NEAR WALTONVILLE, IL",7140106,Illinois,Jefferson County
05597000,"BIG MUDDY RIVER AT PLUMFIELD, IL",7140106,Illinois,Franklin County
05597500,"CRAB ORCHARD CREEK NEAR MARION, IL",7140106,Illinois,Williamson County
06019500,"Ruby River above reservoir near Alder, MT",10020003,Montana,Madison County
06020600,"Ruby River below reservoir near Alder, MT",10020003,Montana,Madison County
06025500,Big Hole River near Melrose MT,10020004,Montana,Madison County
06036650,Jefferson River near Three Forks MT,10020005,Montana,Broadwater County
06038500,Madison River bl Hebgen Lake nr Grayling MT,10020007,Montana,Gallatin County
06052500,Gallatin River at Logan MT,10020008,Montana,Gallatin County
06054500,Missouri River at Toston MT,10030101,Montana,Broadwater County
06066500,Missouri River bl Holter Dam nr Wolf Cr MT,10030102,Montana,Lewis and Clark County
06088500,Muddy Creek at Vaughn MT,10030104,Montana,Cascade County
06089000,Sun River near Vaughn MT,10030104,Montana,Cascade County
06091700,Two Medicine River bl South Fork nr Browning MT,10030201,Montana,Glacier County
06093200,Badger Cr bl Four Horns Canal nr Browning MT,10030201,Montana,Glacier County
06101500,Marias River near Chester MT,10030203,Montana,Liberty County
06108000,Teton River near Dutton MT,10030205,Montana,Teton County
06120500,Musselshell River at Harlowton MT,10040201,Montana,Wheatland County
06126500,Musselshell River near Roundup MT,10040202,Montana,Musselshell County
06130500,Musselshell River at Mosby MT,10040205,Montana,Petroleum County
06154400,Peoples Creek near Hays MT,10050009,Montana,Blaine County
06191500,Yellowstone River at Corwin Springs MT,10070002,Montana,Park County
06192500,"Yellowstone River near Livingston, MT",10070002,Montana,Park County
06195600,Shields River nr Livingston MT,10070003,Montana,Park County
06200000,Boulder River at Big Timber MT,10070002,Montana,Sweet Grass County
06204050,West Rosebud Creek near Roscoe MT,10070005,Montana,Stillwater County
06207500,Clarks Fork Yellowstone River nr Belfry MT,10070006,Montana,Carbon County
06214500,Yellowstone River at Billings MT,10070004,Montana,Yellowstone County
06224000,"BULL LAKE CREEK ABOVE BULL LAKE, WY",10080001,Wyoming,Fremont County
06228000,"WIND RIVER AT RIVERTON, WY",10080001,Wyoming,Fremont County
06235500,"LITTLE WIND RIVER NEAR RIVERTON, WY",10080002,Wyoming,Fremont County
06278300,"SHELL CREEK ABOVE SHELL CREEK RESERVOIR, WY",10080010,Wyoming,Big Horn County
06279500,"BIGHORN RIVER AT KANE, WY",10080010,Wyoming,Big Horn County
06280300,"SOUTH FORK SHOSHONE RIVER NEAR VALLEY, WY",10080013,Wyoming,Park County
06281000,"SOUTH FORK SHOSHONE RIVER AB BUFFALO BILL RES, WY",10080013,Wyoming,Park County
06285100,"SHOSHONE RIVER NEAR LOVELL, WY",10080014,Wyoming,Big Horn County
06289000,Little Bighorn River at State Line nr Wyola MT,10080016,Montana,Big Horn County
06294000,Little Bighorn River near Hardin MT,10080016,Montana,Big Horn County
06298000,"TONGUE RIVER NEAR DAYTON, WY",10090101,Wyoming,Sheridan County
06306300,Tongue River at State Line nr Decker MT,10090101,Montana,Big Horn County
06307500,Tongue River at Tongue R Dam nr Decker MT,10090101,Montana,Big Horn County
06307616,Tongue R at Birney Day School Br nr Birney MT,10090102,Montana,Rosebud County
06308500,"Tongue River at Miles City, MT",10090102,Montana,Custer County
